{
  "disease_names": {
    "pneumonia": "肺炎（肺部感染）",
    "acute_renal_failure": "急性肾衰竭",
    "dilated_cardiomyopathy": "扩张型心肌病（DCM）",
    "phosphorus_poisoning": "磷化锌/磷化铝灭鼠药中毒",
    "gastric_dilatation_volvulus": "胃扩张扭转（GDV）",
    "immune_mediated_hemolytic_anemia": "免疫介导性溶血性贫血（IMHA）",
    "urinary_obstruction": "尿道梗阻",
    "diabetic_ketoacidosis": "糖尿病酮症酸中毒（DKA）",
    "pericardial_effusion": "心包积液/心脏填塞",
    "disseminated_intravascular_coagulation": "弥散性血管内凝血（DIC）",
    "hepatic_failure_coagulopathy": "肝功能衰竭伴凝血障碍",
    "splenic_rupture": "脾脏破裂（急性失血）"
  },
  "clues": {
    "pneumonia": [
      "PaO2_low",
      "PaCO2_high",
      "SpO2_low",
      "wbc_high",
      "hr_high",
      "rr_high",
      "temp_high",
      "lung_exudate_xray",
      "lung_exudate_ct",
      "lung_exudate_us",
      "crackles"
    ],
    "acute_renal_failure": [
      "gfr_low",
      "bun_high",
      "potassium_high",
      "ph_low",
      "hr_low",
      "map_high",
      "cr_high",
      "usg_low",
      "upcr_high",
      "t_wave_tall",
      "qrs_wide"
    ],
    "dilated_cardiomyopathy": [
      "hr_high",
      "hr_low",
      "map_low",
      "cvp_high",
      "gfr_low",
      "bun_high",
      "lung_exudate_us",
      "cardiomegaly_xray",
      "cardiomegaly_us",
      "weak_pulse",
      "qrs_wide"
    ],
    "phosphorus_poisoning": [
      "hr_high",
      "hr_low",
      "map_low",
      "gfr_low",
      "ph_low",
      "temp_high",
      "temp_low",
      "cvp_high",
      "weak_pulse",
      "p_wave_absent"
    ],
    "gastric_dilatation_volvulus": [
      "hr_high",
      "hr_low",
      "map_low",
      "cvp_low",
      "ph_low",
      "lactate_high",
      "temp_low",
      "weak_pulse",
      "abdominal_distension",
      "arrhythmia",
      "p_wave_absent",
      "ph_high"
    ],
    "immune_mediated_hemolytic_anemia": [
      "hr_high",
      "hct_low",
      "map_low",
      "bilirubin_high",
      "SpO2_low",
      "weak_pulse",
      "icterus"
    ],
    "urinary_obstruction": [
      "hr_low",
      "hr_high",
      "map_high",
      "gfr_low",
      "bun_high",
      "potassium_high",
      "ph_low",
      "cvp_high",
      "bladder_distension",
      "anuria",
      "cr_high",
      "usg_low",
      "upcr_high",
      "t_wave_tall",
      "qrs_wide"
    ],
    "diabetic_ketoacidosis": [
      "hr_high",
      "map_low",
      "rr_high",
      "ph_low",
      "glucose_high",
      "hco3_low",
      "cvp_low",
      "kussmaul_respiration",
      "dehydration",
      "ketone_high",
      "potassium_low"
    ],
    "pericardial_effusion": [
      "hr_high",
      "map_low",
      "cvp_high",
      "SpO2_low",
      "weak_pulse",
      "pulsus_paradoxus",
      "muffled_heart_sounds",
      "jugular_distension"
    ],
    "disseminated_intravascular_coagulation": [
      "hr_high",
      "map_low",
      "gfr_low",
      "ph_low",
      "SpO2_low",
      "plt_low",
      "weak_pulse",
      "hemorrhage",
      "petechiae"
    ],
    "hepatic_failure_coagulopathy": [
      "pt_prolonged",
      "aptt_prolonged",
      "fibrinogen_low",
      "albumin_low",
      "ammonia_high",
      "alt_high",
      "hr_high",
      "map_low",
      "weak_pulse"
    ],
    "splenic_rupture": [
      "splenic_mass",
      "abdominal_pain",
      "hr_high",
      "map_low",
      "weak_thready_pulse",
      "pale_mucous_membranes",
      "distended_abdomen",
      "hct_low",
      "lactate_high",
      "hemorrhage"
    ]
  },
  "clue_descriptions": {
    "PaO2_low": "低氧血症",
    "PaCO2_high": "高碳酸血症",
    "SpO2_low": "血氧饱和度降低",
    "wbc_high": "白细胞升高",
    "hr_high": "心率加快",
    "hr_low": "心动过缓",
    "rr_high": "呼吸频率加快",
    "temp_high": "体温升高",
    "map_high": "高血压",
    "map_low": "低血压",
    "ph_low": "酸中毒",
    "gfr_low": "GFR降低",
    "bun_high": "BUN升高",
    "potassium_high": "高钾血症",
    "lung_exudate_xray": "X光肺渗出影",
    "lung_exudate_ct": "CT肺渗出影",
    "lung_exudate_us": "超声肺实变",
    "crackles": "湿啰音",
    "cvp_high": "中心静脉压升高",
    "cardiomegaly_xray": "心影增大",
    "cardiomegaly_us": "心腔扩大",
    "weak_pulse": "脉搏弱",
    "cvp_low": "中心静脉压降低",
    "lactate_high": "乳酸升高",
    "temp_low": "低体温",
    "arrhythmia": "心律失常",
    "abdominal_distension": "腹部膨隆",
    "hct_low": "红细胞比容降低",
    "bilirubin_high": "高胆红素血症",
    "icterus": "黄疸",
    "bladder_distension": "膀胱膨大",
    "anuria": "无尿",
    "glucose_high": "高血糖",
    "hco3_low": "碳酸氢根降低",
    "kussmaul_respiration": "Kussmaul呼吸",
    "dehydration": "脱水",
    "pulsus_paradoxus": "奇脉",
    "muffled_heart_sounds": "心音遥远",
    "jugular_distension": "颈静脉怒张",
    "plt_low": "血小板减少",
    "hemorrhage": "出血",
    "petechiae": "瘀点瘀斑",
    "potassium_low": "低钾血症",
    "cr_high": "肌酐升高",
    "ketone_high": "酮体升高",
    "ph_high": "碱中毒",
    "t_wave_tall": "T波高尖",
    "qrs_wide": "QRS增宽",
    "p_wave_absent": "P波消失",
    "usg_low": "尿比重降低",
    "upcr_high": "尿蛋白/肌酐比升高",
    "pt_prolonged": "凝血酶原时间延长",
    "aptt_prolonged": "活化部分凝血活酶时间延长",
    "fibrinogen_low": "纤维蛋白原降低",
    "albumin_low": "白蛋白降低",
    "ammonia_high": "血氨升高",
    "alt_high": "ALT升高",
    "splenic_mass": "脾脏肿物",
    "abdominal_pain": "腹部疼痛",
    "weak_thready_pulse": "脉搏细弱",
    "pale_mucous_membranes": "黏膜苍白",
    "distended_abdomen": "Distended Abdomen"
  },
  "clue_to_test": {
    "PaO2_low": "blood_gas",
    "PaCO2_high": "blood_gas",
    "SpO2_low": "blood_gas",
    "wbc_high": "blood_routine",
    "hr_high": "physical",
    "hr_low": "ecg",
    "rr_high": "physical",
    "temp_high": "physical",
    "lung_exudate_xray": "chest_xray",
    "lung_exudate_ct": "ct",
    "lung_exudate_us": "ultrasound",
    "crackles": "auscultation",
    "gfr_low": "blood_biochem",
    "bun_high": "blood_biochem",
    "potassium_high": "blood_biochem",
    "ph_low": "blood_gas",
    "map_high": "blood_pressure",
    "map_low": "physical",
    "cvp_high": "physical",
    "cardiomegaly_xray": "chest_xray",
    "cardiomegaly_us": "ultrasound",
    "weak_pulse": "physical",
    "cvp_low": "physical",
    "lactate_high": "blood_gas",
    "temp_low": "physical",
    "arrhythmia": "ecg",
    "abdominal_distension": "physical",
    "hct_low": "blood_routine",
    "bilirubin_high": "blood_biochem",
    "icterus": "inspection",
    "bladder_distension": "ultrasound",
    "anuria": "physical",
    "glucose_high": "blood_biochem",
    "hco3_low": "blood_gas",
    "kussmaul_respiration": "physical",
    "dehydration": "inspection",
    "pulsus_paradoxus": "blood_pressure",
    "muffled_heart_sounds": "auscultation",
    "jugular_distension": "inspection",
    "plt_low": "blood_routine",
    "hemorrhage": "inspection",
    "petechiae": "inspection",
    "potassium_low": "blood_biochem",
    "cr_high": "blood_biochem",
    "ketone_high": "blood_biochem",
    "ph_high": "blood_gas",
    "t_wave_tall": "ecg",
    "qrs_wide": "ecg",
    "p_wave_absent": "ecg",
    "usg_low": "urinalysis",
    "upcr_high": "urinalysis",
    "pt_prolonged": "blood_coagulation",
    "aptt_prolonged": "blood_coagulation",
    "fibrinogen_low": "blood_coagulation",
    "ammonia_high": "blood_biochem",
    "albumin_low": "blood_biochem",
    "alt_high": "blood_biochem",
    "splenic_mass": "ultrasound",
    "abdominal_pain": "physical",
    "weak_thready_pulse": "physical",
    "pale_mucous_membranes": "inspection"
  },
  "treatment_protocols": {
    "dilated_cardiomyopathy": [
      {
        "drug_name": "pimobendan",
        "dose_mg_kg": 0.25
      },
      {
        "drug_name": "furosemide",
        "dose_mg_kg": 1.0
      }
    ],
    "pneumonia": [
      {
        "drug_name": "fluid_bolus",
        "volume_ml": 200
      }
    ],
    "acute_renal_failure": [
      {
        "drug_name": "fluid_bolus",
        "volume_ml": 300
      }
    ],
    "phosphorus_poisoning": [
      {
        "drug_name": "fluid_bolus",
        "volume_ml": 250
      }
    ],
    "gastric_dilatation_volvulus": [
      {
        "drug_name": "fluid_bolus",
        "volume_ml": 500
      }
    ],
    "immune_mediated_hemolytic_anemia": [
      {
        "drug_name": "fluid_bolus",
        "volume_ml": 200
      }
    ],
    "urinary_obstruction": [
      {
        "drug_name": "fluid_bolus",
        "volume_ml": 300
      }
    ],
    "diabetic_ketoacidosis": [
      {
        "drug_name": "fluid_bolus",
        "volume_ml": 400
      }
    ],
    "pericardial_effusion": [
      {
        "drug_name": "fluid_bolus",
        "volume_ml": 150
      }
    ],
    "disseminated_intravascular_coagulation": [
      {
        "drug_name": "fluid_bolus",
        "volume_ml": 350
      }
    ],
    "hepatic_failure_coagulopathy": [
      {
        "drug_name": "vitamin_k",
        "dose_mg_kg": 0.5
      },
      {
        "drug_name": "fluid_bolus",
        "volume_ml": 300
      }
    ],
    "splenic_rupture": [
      {
        "drug_name": "fluid_bolus",
        "volume_ml": 500
      }
    ]
  },
  "messages": {
    "win": {
      "pneumonia": "正确诊断！补液治疗后，患犬的循环状态和氧合逐渐改善。",
      "acute_renal_failure": "正确诊断！积极补液恢复肾灌注后，患犬的肾功能指标开始好转。",
      "dilated_cardiomyopathy": "正确诊断！强心（匹莫苯丹）+ 利尿（呋塞米）治疗后，患犬心功能逐渐改善，呼吸困难缓解。",
      "phosphorus_poisoning": "正确诊断！积极补液和支持治疗后，患犬的中毒症状逐渐缓解，体温和心律趋于稳定。",
      "gastric_dilatation_volvulus": "正确诊断！紧急补液稳定循环后，患犬顺利接受手术复位，胃壁血供恢复。",
      "immune_mediated_hemolytic_anemia": "正确诊断！免疫抑制治疗和输血后，患犬的溶血得到控制，HCT开始回升。",
      "urinary_obstruction": "正确诊断！紧急导尿排除膀胱蓄积尿液后，患犬的高钾和酸中毒迅速纠正。",
      "diabetic_ketoacidosis": "正确诊断！积极补液+胰岛素治疗后，患犬的血糖和酮体逐渐恢复正常，酸中毒纠正。",
      "pericardial_effusion": "正确诊断！心包穿刺引流后，患犬的心脏填塞症状迅速缓解，血压回升。",
      "disseminated_intravascular_coagulation": "正确诊断！积极补液+抗凝+输血支持治疗后，患犬的凝血功能逐渐恢复。",
      "hepatic_failure_coagulopathy": "正确诊断！维生素K1止血+输液支持后，患犬的凝血功能逐渐改善。",
      "splenic_rupture": "正确诊断！紧急输液扩容+配血后，患犬的休克症状得到纠正。"
    },
    "loss": {
      "pneumonia": "误诊！患犬的呼吸系统症状提示存在感染性病变，请重新评估肺部检查。",
      "acute_renal_failure": "误诊！患犬的氮质血症和电解质紊乱提示泌尿系统出了问题，请复查肾功能和尿液。",
      "dilated_cardiomyopathy": "误诊！患犬的心脏扩大伴收缩功能下降，提示心肌病变，请复查心脏超声和心电图。",